{
  "$schema": "../card.schema.json",
  "name": "Undertow Grasp",
  "manaCost": "{1}{U}",
  "manaValue": 2,
  "colors": ["U"],
  "colorIdentity": ["U"],
  "type": "Instant",
  "types": ["Instant"],
  "supertypes": [],
  "subtypes": [],
  "text": "Tap target creature. It doesn't untap during its controller's next untap step.\nScry 1.",
  "rarity": "common",
  "flavorText": "The current does not let go simply because you have stopped struggling.",
  "artist": "AI Generated",
  "set": "GEN",
  "number": "269"
}
