{
  "$schema": "../card.schema.json",
  "name": "Pyroclastic Surge",
  "manaCost": "{2}{R}{R}",
  "manaValue": 4,
  "colors": ["R"],
  "colorIdentity": ["R"],
  "type": "Sorcery",
  "types": ["Sorcery"],
  "supertypes": [],
  "subtypes": [],
  "text": "Pyroclastic Surge deals 3 damage to each creature without flying.",
  "rarity": "uncommon",
  "flavorText": "Stay grounded and you stay ash.",
  "artist": "AI Generated",
  "set": "GEN",
  "number": "282"
}
