{
  "$schema": "../card.schema.json",
  "name": "Riftstalker Weird",
  "manaCost": "{1}{U}",
  "manaValue": 2,
  "colors": ["U"],
  "colorIdentity": ["U"],
  "type": "Creature — Weird",
  "types": ["Creature"],
  "supertypes": [],
  "subtypes": ["Weird"],
  "text": "Riftstalker Weird's power is equal to the number of instant and sorcery cards in your graveyard.",
  "power": "*",
  "toughness": "4",
  "rarity": "rare",
  "flavorText": "Every spell you cast leaves a scar in the air, and it feeds on the scars.",
  "artist": "AI Generated",
  "set": "GEN",
  "number": "296"
}
