{
  "$schema": "../card.schema.json",
  "name": "Spellweaver's Crown",
  "manaCost": "{2}",
  "manaValue": 2,
  "colors": [],
  "colorIdentity": ["U", "R"],
  "type": "Artifact",
  "types": ["Artifact"],
  "supertypes": [],
  "subtypes": [],
  "text": "Whenever you cast an instant or sorcery spell, scry 1.\n{2}, {T}: Add {U}{R}.",
  "keywords": [],
  "rarity": "uncommon",
  "flavorText": "Worn only by those who can hear the future humming.",
  "artist": "AI Generated",
  "set": "GEN",
  "number": "325"
}
