{
  "$schema": "../card.schema.json",
  "name": "Maelstrom Mentor",
  "manaCost": "{2}{U}",
  "manaValue": 3,
  "colors": ["U"],
  "colorIdentity": ["U"],
  "type": "Creature — Human Wizard",
  "types": ["Creature"],
  "supertypes": [],
  "subtypes": ["Human", "Wizard"],
  "text": "Whenever you cast an instant or sorcery spell, create a 1/1 blue Spirit creature token.",
  "power": "2",
  "toughness": "2",
  "keywords": [],
  "rarity": "rare",
  "flavorText": "Her lessons echo in the wind long after class ends.",
  "artist": "AI Generated",
  "set": "GEN",
  "number": "321"
}
