{
  "$schema": "../card.schema.json",
  "name": "Coilspring Talisman",
  "manaCost": "{2}",
  "manaValue": 2,
  "colors": [],
  "colorIdentity": ["U", "R"],
  "type": "Artifact",
  "types": ["Artifact"],
  "supertypes": [],
  "subtypes": [],
  "text": "{T}: Add {C}.\n{T}, Pay 1 life: Add {U} or {R}.",
  "rarity": "uncommon",
  "flavorText": "A little blood greases the gears of genius.",
  "artist": "AI Generated",
  "set": "GEN",
  "number": "222"
}
