{
  "$schema": "../card.schema.json",
  "name": "Galefront Snap",
  "manaCost": "{2}{U}",
  "manaValue": 3,
  "colors": ["U"],
  "colorIdentity": ["U"],
  "type": "Instant",
  "types": ["Instant"],
  "supertypes": [],
  "subtypes": [],
  "text": "Counter target creature spell.\nDraw a card.",
  "rarity": "common",
  "flavorText": "The wind front closed before the beast could land.",
  "artist": "AI Generated",
  "set": "GEN",
  "number": "265"
}
