{
  "$schema": "../card.schema.json",
  "name": "Thundercoil Serpent",
  "manaCost": "{4}{U}{R}",
  "manaValue": 6,
  "colors": ["U", "R"],
  "colorIdentity": ["U", "R"],
  "type": "Creature — Serpent",
  "types": ["Creature"],
  "supertypes": [],
  "subtypes": ["Serpent"],
  "text": "Trample\nWhenever you cast your second spell each turn, Thundercoil Serpent gets +2/+2 until end of turn.",
  "power": "5",
  "toughness": "5",
  "keywords": ["Trample"],
  "rarity": "rare",
  "flavorText": "It surfaces only when the sky and the sea argue.",
  "artist": "AI Generated",
  "set": "GEN",
  "number": "300"
}
