{
  "$schema": "../card.schema.json",
  "name": "Mizzium Conflux",
  "manaValue": 0,
  "colors": [],
  "colorIdentity": ["U", "R"],
  "type": "Land",
  "types": ["Land"],
  "supertypes": [],
  "subtypes": [],
  "text": "{T}: Add {C}.\n{1}, {T}: Add {U} or {R}.",
  "rarity": "uncommon",
  "flavorText": "Mizzium drinks deep before it gives anything back.",
  "artist": "AI Generated",
  "set": "GEN",
  "number": "207"
}
