{
  "$schema": "../card.schema.json",
  "name": "Stormbolt",
  "manaCost": "{1}{R}",
  "manaValue": 2,
  "colors": ["R"],
  "colorIdentity": ["R"],
  "type": "Instant",
  "types": ["Instant"],
  "supertypes": [],
  "subtypes": [],
  "text": "Stormbolt deals 4 damage to target creature or planeswalker.",
  "rarity": "common",
  "flavorText": "Thunder is merely the sound of something already gone.",
  "artist": "AI Generated",
  "set": "GEN",
  "number": "263"
}
