{
  "$schema": "../card.schema.json",
  "name": "Voltaic Lodestone",
  "manaCost": "{2}",
  "manaValue": 2,
  "colors": [],
  "colorIdentity": ["U", "R"],
  "type": "Artifact",
  "types": ["Artifact"],
  "supertypes": [],
  "subtypes": [],
  "text": "{T}: Add {U} or {R}.",
  "rarity": "uncommon",
  "flavorText": "It hums with the storm it remembers.",
  "artist": "AI Generated",
  "set": "GEN",
  "number": "220"
}
