{
  "$schema": "../card.schema.json",
  "name": "Pyric Insight",
  "manaCost": "{1}{U}{R}",
  "manaValue": 3,
  "colors": ["U", "R"],
  "colorIdentity": ["U", "R"],
  "type": "Instant",
  "types": ["Instant"],
  "supertypes": [],
  "subtypes": [],
  "text": "Pyric Insight deals 1 damage to any target.\nDraw two cards.",
  "rarity": "uncommon",
  "flavorText": "Knowledge and flame are the same spark, told twice.",
  "artist": "AI Generated",
  "set": "GEN",
  "number": "244"
}
