{
  "$schema": "../card.schema.json",
  "name": "Stormread Augury",
  "manaCost": "{1}{U}",
  "manaValue": 2,
  "colors": ["U"],
  "colorIdentity": ["U"],
  "type": "Instant",
  "types": ["Instant"],
  "supertypes": [],
  "subtypes": [],
  "text": "Draw two cards, then discard a card.",
  "rarity": "common",
  "flavorText": "The storm whispers tomorrow to those who listen today.",
  "artist": "AI Generated",
  "set": "GEN",
  "number": "240"
}
